base_number,japanese_text,russian_translation,english_original,converb_te_copula,converb_te_no_comma,converb_i_adjective,converb_te_comma,converb_te_period,converb_i,converb_nagara,converb_tari,converbs_amount,types_of_converbs,direct_speech,connection_type_ja,connection_type_en,conjunction_original,lexis,subject,comments
4-26-29,まだどこかにいて、時の来るのを待っているという者もいるな。俺はそうは思わん,"Пока [он] где-то там [te], ждёт подходящего момента – люди, которые говорят так, тоже есть.","Some say he’s still out there, bidin’ his time, like, but I don’ believe it.",нет,нет,нет,да,нет,нет,нет,нет,1,ТЭ,да,образ действия,образ действия,", ing",-,"[2 (te), (0)]",зависимые клаузы
4-26-31,ちんちくりんな髪に刈り上げられて学校に行くのがとてもいやだった時、髪は、あっという間に元通りに伸びたし……,"Когда из-за ужасно подстриженных [te] волос ему был настолько неприятно ходить в школу, что меня подстригли волосы пенисом, его волосы быстро восстановили свое первоначальное состояние...","... dreading going to school with that ridiculous hair-cut, he’d managed to make it grow back ...",нет,да,нет,нет,нет,нет,нет,нет,1,ТЭ,нет,причинность,причинность,-,-,"[(2 te), (2)]",
4-27-1,ハリーはハグリッドに向かってほほえんだ,"Гарри, повернувшись [te] к Хагриду, улыбнулся.","Harry looked back at Hagrid, smiling, and saw that Hagrid waspositively beaming at him.",нет,да,нет,нет,нет,нет,нет,нет,1,ТЭ,нет,образ действия,образ действия,ing,-,"[3 (te), (0)]",
4-27-12,これまでと違って、同じ仲間の子供たちと共に過ごすんだ。,"Отличаясь [te] от того, что было до, [он] будет проводить время с такими же друзьями-детьми. ","He’ll be with youngsters of his own sort, fer a change, an’ he’ll be under the greatest Headmaster Hogwarts ever had, Albus Dumbled–‘",нет,нет,нет,да,нет,нет,нет,нет,1,ТЭ,да,фон-фигура,-,-,-,"[(3 te), (2)]",
4-27-15,ハグリッドは傘をつかんで、頭の上でグルグル回した,"В конце концов эти слова были уже чересчур. Хагрид схватил [свой] зонт [te], по кругу завертел им над головой.",Hagrid seized his umbrella and whirled it over his head.,нет,нет,нет,да,нет,нет,нет,нет,1,ТЭ,нет,последовательность действий,последовательность действий,and,-,"[2 (te), (0)]",
4-27-21,一瞬、紫色の光が走り、爆竹のような音がしたかと思うと、鋭い悲鳴がして、次の瞬間、ダドリーは太ったお尻を両手で押さえ、痛みで喚きながら床の上を飛び跳ねていた。,"Резко вспыхнул фиолетовый цвет [i], раздался звук, похожий на петарду, [затем] раздался пронзительный крик [te], а в следующий момент Дадли, обхватив обеими руками свой толстый зад [i], крича от боли [nagara] подпрыгивал на полу.’"," there was a flash of violet light, a sound like a firecracker, a sharp squeal and next second, Dudley was dancing on the spot with his hands clasped over his fat bottom, howling in pain.",нет,нет,нет,да,нет,2,да,нет,4,"И, ТЭ, И, НАГАРА",нет,фон-фигура,"А, Б, и С with D ing E",and,-,"[(3 te), (2)]",
4-27-32,ハグリッドは分厚いコートを脱いで、ハリーに放ってよこした,Хагрид снял [te] своё тяжелое пальто и протянул его Гарри.,He took off his thick black coat and threw it to Harry,нет,да,нет,нет,нет,нет,нет,нет,1,ТЭ,нет,образ действия,образ действия,prep,-,"[3 (te), (0)]",
4-27-33,おまえさんを追いかけて、手紙を渡したりいろいろするのに、少しは使ってもいいとお許しが出た,"[Мне] выдали разрешение использовать немного магии, преследуя тебя [te], передавая письма и всякие разные дела, но",I was allowed ter do a bit ter follow yeh an’ get yer letters to yeh an’ stuff,нет,нет,нет,да,нет,нет,нет,нет,1,ТЭ,да,последовательность действий,последовательность действий,and,-,"[2 (te), (0)]",зависимые клаузы
4-27-37,ふむ、まあ――俺もホグワーツ出身で、ただ、俺は……その……実は退学処分になったんだ,"Ох, ну, я тоже из Хогвартса [te], но я… это… по правде говоря, был исключён.","Oh, well – I was at Hogwarts meself but I – er – got expelled, ter tell yeh the truth",да,нет,нет,нет,нет,нет,нет,нет,1,ТЭ,да,перечисление характеристик,перечисление характеристик,-,-,"[(te), (2)]",
4-27-38,町へ行って、教科書やら何やら買わんとな,"‘Надо поехать в город [te], купить учебники, что-то ещё.’","Gotta get up ter town, get all yer books an’ that.",нет,нет,нет,да,нет,нет,нет,нет,1,ТЭ,да,последовательность действий,последовательность действий,запятая,-,"[2 (te), (0)]",зависимое 
4-27-43,ハグリッドは分厚いコートを脱いで、ハリーに放ってよこした,"‘Хагрид снял тяжёлую куртку [te], протянул её Гарри.’",He took off his thick black coat and threw it to Harry,нет,нет,нет,да,нет,нет,нет,нет,1,ТЭ,нет,последовательность действий,последовательность действий,and,-,"[2 (te), (0)]",
5-28-1,ハグリッドつていう大男がやってきて、僕が魔法使いの学校に入るって言ったけど、あれは夢だったんだ,"Пришёл великан по имени Хагрид [te], сказал, что я поступлю в школу волшебников, но это был сон.",I dreamed a giant called Hagrid came to tell me I was going to a school for wizards.,нет,нет,нет,да,нет,нет,нет,нет,1,ТЭ,да,последовательность действий,последовательность действий,to,-,"[3 (te), (0)]",
5-28-11,嬉しくて、胸の中で風船が大きく膨らんだ。," [Он был] рад [te], внутри груди набух большой воздушный шар.","Harry scrambled to his feet, so happy he felt as though a large balloon was swelling inside him.",нет,нет,нет,да,нет,нет,нет,нет,1,ТЭ,нет,фон-фигура,фон-фигура,as,-,"[(3 te), (2)]",
5-28-12,まっすぐ窓辺まで行って、窓を開け放った,"[Гарри] подошёл прямо к подоконнику [te], распахнул окно.",He went straight to the window and jerked it open.,нет,нет,нет,да,нет,нет,нет,нет,1,ТЭ,нет,последовательность действий,последовательность действий,and,-,"[2 (te), (0)]",
5-28-13,ふくろうが窓からスイーッと入ってきて、新聞をハグリッドの上にポトリと落とした。,"Сова со свистом влетела [в комнату][te], со шлепком уронила на Хагрида газету. ","The owl swooped in and dropped the newspaper on top of Hagrid, who didn’t wake up.",нет,нет,нет,да,нет,нет,нет,нет,1,ТЭ,нет,последовательность действий,последовательность действий,and,-,"[3 (te), (0)]",
5-28-14,ハリーがふくろうを追い払おうとすると、ふくろうは鋭い嘴をハリーに向かってカチカチ言わせ、獰猛にコートを襲い続けた。,"Когда Гарри попытался избавиться от совы, она, повернувшись [te] к Гарри и издавая звуки клювом [i], продолжала яростно атаковать его пальто.","Harry tried to wave the owl out of the way, but it snapped its beak fiercely at him and carried on savaging the coat.",нет,да,нет,нет,нет,да,нет,нет,2,"ТЭ, И",нет,образ действия,образ действия,prep,-,"[2 (te), (0)]",
5-28-30,ハグリッドは大声であくびをして起き上がり、もう一度伸びをした。,"Хагрид громко зевнул [te] и встал [i], снова потягиваясь.","Hagrid yawned loudly, sat up and stretched.",нет,да,нет,нет,нет,да,нет,нет,2,"ТЭ, И",нет,последовательность действий,последовательность действий,запятая,-,"[2 (te), (0)]",
5-28-36,ロンドンまで行って、おまえさんの入学用品を揃えんとな,"Доедем до Лондона [te], нужно будет собрать вещи для твоего поступления.","Best be off, Harry, lots ter do today, gotta get up ter London an’ buy all yer stuff fer school.",нет,нет,нет,да,нет,нет,нет,нет,1,ТЭ,нет,последовательность действий,последовательность действий,and,-,"[2 (te), (0)]",
5-28-41,ハグリッドは立ち上がって頭をボソボソ掻きながら言った。,"Хагрид встал [te] и, почёсывая [nagara] голову, сказал.","said Hagrid, standing up and scratching his head.",нет,да,нет,нет,нет,нет,да,нет,2,"ТЭ, НАГАРА",нет,последовательность действий,последовательность действий,ing,-,"[2 (te), (0)]",
5-29-4,ダンブルドアに頼まれて、ホグワーツの仕事だ。,"Меня попросил Дамблдор [te], работа для Хогвартса.",Fer Dumbledore. Hogwarts business.,нет,нет,нет,да,нет,нет,нет,нет,1,ТЭ,да,последовательность действий,последовательность действий,-,-,"[2 (te), (0)]",не уверена
5-29-14,ハリーは魔法が見たくてウズウズしていた。,"Гарри, желая [te] увидеть волшебство, сгорал от нетерпения.","Harry, eager to see more magic.",нет,да,нет,нет,нет,нет,нет,нет,1,ТЭ,нет,причинность,причинность,to,-,"[2 (te), (0)]",
5-29-21,な？地下鉄たら言うのより深いと聞いとる。何とか欲しいものを手に入れたにしても、迷って出てこられなけりゃ、餓死するわな」,"Верно? Я слышал, что он глубже, чем метро. Даже если вам удастся получить желаемое, если вы заблудитесь [te] и не сможете выбраться, вы умрете от голода.","See. Deep under the Underground. Yeh’d die of hunger tryin’ ter get out, even if yeh did manage ter get yer hands on summat.",нет,да,нет,нет,нет,нет,нет,нет,1,ТЭ,да,образ действия,образ действия,ing,-,"[2 (te), (0)]",
5-29-22,ハグリッドが「日刊予言者新聞」を読む間、ハリーは黙って今聞いたことを考えていた。,"Пока Хагрид читал «Ежедневный пророк», Гарри сидел молча [te], размышляя о том, что только что услышал.","Harry sat and thought about this while Hagrid read his newspaper, the Daily Prophet.",нет,да,нет,нет,нет,нет,нет,нет,1,ТЭ,нет,образ действия,образ действия,-,-,"[3 (te), (0)]",
5-29-23,生まれてこのかた、こんなにたくさん質問したかったことはない。,"После того как он родился [te], ему никогда в жизни не хотелось задать столько вопросов.",he’d never had so many questions in his life.,нет,да,нет,нет,нет,нет,нет,нет,1,ТЭ,нет,последовательность действий,-,-,-,"[2 (te), (0)]",
5-29-24,ハグリッドはまたしてもピンクの傘を取り出して、船べりを傘で二度叩いた。,"Хагрид снова вытащил розовый зонтик [te], дважды постучал зонтиком по борту лодки","Hagrid pulled out the pink umbrella again, tapped it twice on the side of the boat and they sped off towards land.",нет,нет,нет,да,нет,нет,нет,нет,1,ТЭ,нет,последовательность действий,последовательность действий,запятая,-,"[2 (te), (0)]",
5-29-31,毎朝ふくろう便を何羽も出してダンブルドアにしつこくお伺いをたてとるよ,"Каждое утро он отправляет [te] несколько сов, прося Дамблдора дать мне совет.","So he pelts Dumbledore with owls every morning, askin’ fer advice.",нет,да,нет,нет,нет,нет,нет,нет,1,ТЭ,нет,образ действия,образ действия,-,-,"[2 (te), (0)]",
5-29-40,ハグリッドは新聞をたたみ、二人は石段を登って道に出た。,"Хагрид сложил [i] газету, и они вдвоём, поднявшись [te] по каменным ступеням, вышли на дорогу.",Hagrid folded up his newspaper and they clambered up the stone steps on to the street.,нет,да,нет,нет,нет,да,нет,нет,2,"И, ТЭ",нет,образ действия,образ действия,-,-,"[2 (te), (0)]",
5-29-42,小さな町を駅に向かって歩く途中、道行く人がハグリッドをジロジロ見た。,"Пока они шли, направляясь [te] в сторону станции через маленький городок, прохожие глазели на Хагрида.",Passers-by stared a lot at Hagrid as they walked through the little town to the station.,нет,да,нет,нет,нет,нет,нет,нет,1,ТЭ,нет,образ действия,образ действия,prep,-,"[(2 te), (3)]",
5-30-8,二人分の席を占領して、カナリア色のサーカスのテントのようなものを編みはじめたのだ。,"[Хагрид] занял два сиденья [te], начал вязать вещь канареечного цвета, похожую на цирковой шатёр.",Hagrid took up two seats and sat knitting what looked like a canary-yellow circus tent.,нет,нет,нет,да,нет,нет,нет,нет,1,ТЭ,нет,последовательность действий,последовательность действий,and,-,"[2 (te), (0)]",
5-30-14,ハリーは、昨夜気づかなかった二枚目の紙を広げて読み上げた。,"Гарри развернул [te] вторую газету, которую не заметил вчера вечером, и прочитал её вслух.",Harry unfolded a second piece of paper he hadn’t noticed the night before and read,нет,да,нет,нет,нет,нет,нет,нет,1,ТЭ,нет,последовательность действий,последовательность действий,and,-,"[2 (te), (0)]",
5-31-7,故障して動かないエスカレーターを上りながらもハグリッドは文句を言う。,"Сломанный [te], неработающий эскалатор – поднимаясь [nagara] по нему, Хагрид жалуется.","he said, as they climbed a broken-down escalator which led up to a bustling road lined with shops.",нет,да,нет,нет,нет,нет,да,нет,2,"ТЭ, НАГАРА",нет,перечисление характеристик,перечисление характеристик,-,-,"[(te), (2)]",
5-31-24,隅の方におばあさんが二、三人腰掛けて小さなグラスでシェリー酒を飲んでいた。,Две или три старушки сидели [te] в углу и пили херес из маленьких рюмок.,"A few old women were sitting in a corner, drinking tiny glasses of sherry.",нет,да,нет,нет,нет,нет,нет,нет,1,ТЭ,нет,образ действия,образ действия,ing,-,"[3 (te), (0)]",
5-31-38(1),バーテンは急いでカウンターから出てきてハリーにかけ寄ると、涙を浮かべてハリーの手を握った。,"Бармен выскочил [te] из-за стойки, подбежал к Гарри, плача [te], и пожал ему руку.","He hurried out from behind the bar, rushed towards Harry and seized his hand, tears in his eyes.",нет,да,нет,нет,нет,нет,нет,нет,1,ТЭ,нет,последовательность действий,последовательность действий,запятая,-,"[2 (te), (0)]",
5-31-38(2),バーテンは急いでカウンターから出てきてハリーにかけ寄ると、涙を浮かべてハリーの手を握った。,"Бармен выскочил [te] из-за стойки, подбежал к Гарри, плача [te], и пожал ему руку.","He hurried out from behind the bar, rushed towards Harry and seized his hand, tears in his eyes.",нет,да,нет,нет,нет,нет,нет,нет,1,ТЭ,нет,образ действия,образ действия,-,-,"[2 (te), (0)]",
5-31-44,やがてあちらこちらで椅子を動かす音がして、パブにいた全員がハリーに握手を求めてきた,"‘Затем там и сям раздался звук двигающихся стульев [te], все посетители паба пришли пожать руку Гарри.’","Then there was a great scraping of chairs and, next moment, Harry found himself shaking hands with everyone in the Leaky Cauldron.",нет,нет,нет,да,нет,нет,нет,нет,1,ТЭ,нет,фон-фигура,фон-фигура,and,-,"[(3 te), (3)]",
5-32-17,それから十分ほどかかって、ハリーはやっとみんなから離れることができた。,"Прошло около десяти минут [te], Гарри наконец смог оторваться от всех.",It took almost ten minutes to get away from them all.,нет,нет,нет,да,нет,нет,нет,нет,1,ТЭ,нет,фон-фигура,фон-фигура,to,-,"[(2 te), (3)]",
5-32-23,ハグリッドはハリーに向かって、うれしそうに笑いかけながら言った。,"Хагрид повернулся к Гарри [te], сказал, радостно ухмыляясь",Hagrid grinned at Harry.,нет,нет,нет,да,нет,нет,нет,нет,1,ТЭ,нет,образ действия,-,-,-,"[2 (te), (0)]",
5-32-39,そのむこうには石畳の通りが曲がりくねって先が見えなくなるまで続いていた。,Дальше мощеная улица петляет [te] и исчезает из виду.,a cobbled street which twisted and turned out of sight.,нет,да,нет,нет,нет,нет,нет,нет,1,ТЭ,нет,последовательность действий,последовательность действий,and,-,"[3 (te), (0)]",
5-32-41,ハリーが急いで振り返った時には、アーチは見るみる縮んで、固いレンガ壁に戻るところだった,"Когда Гарри быстро обернулся, арка сжалась [te], превратилась обратно в твёрдую кирпичную стену.",Harry looked quickly over his shoulder and saw the archway shrink instantly back into solid wall.,нет,нет,нет,да,нет,нет,нет,нет,1,ТЭ,нет,образ действия,-,into  ,-,"[2 (te), (0)]",
5-32-42,ハリーが驚いているのを見て、ハグリッドがニコーッと笑った,"[Хагрид] смотрел на удивление Гарри [te], приятно смеялся.",He grinned at Harry’s amazement.,нет,нет,нет,да,нет,нет,нет,нет,1,ТЭ,нет,образ действия,-,-,-,"[3 (te), (0)]",
5-33-1,ハリーと同い年ぐらいの男の子が数人、箒のショーウィンドウに鼻をくっつけて眺めている。,"Несколько мальчиков примерно возраста Гарри, прижавшись [te] к витрине с мётлами носами, смотрели в упор.",Several boys of about Harry’s age had their noses pressed against a window with broomsticks in it.,нет,да,нет,нет,нет,нет,нет,нет,1,ТЭ,нет,образ действия,образ действия,ed,-,"[3 (te), (0)]",
5-33-9,磨き上げられたブロンズの観音開きの扉の両脇に、真紅と金色の制服を着て立っているのは……,"По обе стороны от полированных бронзовых двойных дверей, одетый в [te] малиново-золотую форму, стоял...","Standing beside its burnished bronze doors, wearing a uniform of scarlet and gold, was –",нет,да,нет,нет,нет,нет,нет,нет,1,ТЭ,нет,образ действия,образ действия,ing,-,"[(te), (2)]",
5-33-11,そちらに向かって白い石段を登りながら、ハグリッドがヒソヒソ声で言った。,"Направляясь [te] туда, поднимаясь [nagara] по белым ступеням, прошептал Хагрид.",said Hagrid quietly as they walked up the white stone steps towards him.,нет,да,нет,нет,нет,нет,да,нет,2,"ТЭ, НАГАРА",нет,образ действия,образ действия,prep,-,"[(te), (3)]",
5-33-29,ホールに通じる扉は無数にあって、これまた無数のゴブリンが、出入りする人々を案内している,"Было бесчисленное количество ведущих в холл дверей [te], то же бесчисленное количество гоблинов провожало входящих и выходящих людей.","There were too many doors to count leading off the hall, and yet more goblins were showing people in and out of these.",нет,нет,нет,да,нет,нет,нет,нет,1,ТЭ,нет,фон-фигура,фон-фигура,and,-,"[(2 te), (3)]",
5-33-40,ハリーは右側の方にいるゴブリンが、まるで真っ赤に燃える石炭のような大きいルビーを山と積んで、次々に秤にかけているのを眺めていた,"Гарри наблюдал за тем, как гоблин на правой стороне складывал полностью красные, как горящие угли, большие рубины в кучки [te], один за другим клал [рубины] на весы.",Harry watched the goblin on their right weighing a pile of rubies as big as glowing coals.,нет,нет,нет,да,нет,нет,нет,нет,1,ТЭ,нет,последовательность действий,-,-,-,"[(2 te), (0)]",зависимые клаузы
5-34-5,グリップフックが口笛を吹くと、小さなトロッコがこちらに向かって元気よく線路を上がってきた。,"Крюкохват свистнул, и, направляясь [te] к ним, по рельсам быстро приехала небольшая вагонетка.",Griphook whistled and a small cart came hurtling up the tracks towards them.,нет,да,нет,нет,нет,нет,нет,нет,1,ТЭ,нет,образ действия,образ действия,prep,-,"[3 (te), (0)]",
5-34-11(1),一度は、行く手に火が吹き出したような気がして、もしかしたらドラゴンじゃないかと身をよじって見てみたが、遅かった,"Один раз у Гарри возникло впечатление, что на пути будто вспыхивало пламя [te], “Неужто дракон?..” – он попробовал, повернувшись [te], посмотреть, но было поздно – тележка глубже и глубже уходила вниз.","Once, he thought he saw a burst of fire at the end of a passage and twisted around to see if it was a dragon, but too late",нет,нет,нет,да,нет,нет,нет,нет,1,ТЭ,нет,фон-фигура,фон-фигура,-,-,"[(3 te), (2)]",
