base_number,japanese_text,russian_translation,english_original,converb_te_copula,converb_te_no_comma,converb_i_adjective,converb_te_comma,converb_te_period,converb_i,converb_nagara,converb_tari,converbs_amount,types_of_converbs,direct_speech,connection_type_ja,connection_type_en,conjunction_original,lexis,subject,comments
1-9-10,ダンブルドアはクルリと背を向け、通りのむこうに向かって歩き出した,"Дамблдор кругом развернулся [i], повернулся к противоположной стороне улицы [te], пошёл.",Dumbledore turned and walked back down the street.,нет,да,нет,нет,нет,да,нет,нет,2,"И, ТЭ",нет,последовательность действий,последовательность действий,and,-,"[2 (te), (0)]",
2-9-38,初めて自転車に乗った姿、お祭りの回転木馬の上、パパとコンピュータ・ゲーム、ママに抱きしめられてキスされる姿,"[Теперь на фотографиях была] ездившая на первом велосипеде фигура, фигура верхом на карусели, [играющая] с папой в компьютерные игры, которую обнимает мама [te] и целует.","blond boy riding his first bicycle, on a roundabout at the fair, playing a computer game with his father, being hugged and kissedby his mother.",нет,да,нет,нет,нет,нет,нет,нет,1,ТЭ,нет,последовательность действий,последовательность действий,and,-,"[2 (te), (0)]",
2-9-43,ハリーは驚いて目を覚ました,Гарри удивился [te] и проснулся.’,Harry woke with a start.,нет,да,нет,нет,нет,нет,нет,нет,1,ТЭ,нет,причинность,образ действия,prep,-,"[2 (te), (0)]",
2-9-54,「まだ起きないのかい？」おばさんが戸のむこうに戻ってきて、きつい声を出した。,"‘“Ещё не встал?” – тётушка повернулась к противоположной стороне двери [te], сказала строгим голосом.’",His aunt was back outside the door. ‘Are you up yet?’ she demanded.,нет,нет,нет,да,нет,нет,нет,нет,1,ТЭ,нет,последовательность действий,-,-,-,"[3 (te), (0)]",
2-10-11,服を着ると、ハリーは廊下に出てキッチンに向かった,"Когда Гарри надел одежду, он вышел в коридор [te] и направился к кухне.",When he was dressed he went down the hall into the kitchen.,нет,да,нет,нет,нет,нет,нет,нет,1,ТЭ,нет,последовательность действий,образ действия,prep,-,"[2 (te), (0)]",
2-10-12,食卓はダドリーの誕生日のプレゼントの山に埋もれてほとんど見えなかった,"‘Стол был скрыт подарками Дадли на день рождения [te], почти не виднелся.’",The table was almost hidden beneath all Dudley’s birthday presents.,нет,да,нет,нет,нет,нет,нет,нет,1,ТЭ,нет,причинность,причинность,ed,-,"[2 (te), (0)]",
2-10-18,その上、着るものはハリーの四倍も大きいダドリーのお古ばかりだったので、ますますやせて小さく見えた,"Более того, то, что носил [Гарри], было только старыми вещами Дадли, который был в четыре раза больше него, и поэтому он ещё больше казался худым [te] и маленьким.",He looked even smaller and skinnier than he really was because all he had to wear were old clothes of Dudley’s and Dudley was about four times bigger than he was.,нет,да,нет,нет,нет,нет,нет,нет,1,ТЭ,нет,перечисление характеристик ,перечисление характеристик ,and,-,"[2 (te), (0)]",
2-10-20,ハリーは、膝小僧が目立つような細い脚で、細面の顔に真っ黒な髪、明るい緑色の目をしていた,"У Гарри были худые ноги с выступающими коленными чашечками [te], стройное лицо и чёрные волосы, светлые зелёные глаза.","Harry had a thin face, knobbly knees, black hair and bright-green eyes.",да,нет,нет,нет,нет,нет,нет,нет,1,ТЭ,нет,перечисление характеристик,перечисление характеристик,запятая,-,"[2 (te), (0)]",и связка опять же
2-10-31,ハリーが卵を焼いていると、ダドリーが母親に連れられてキッチンに入ってきた,"Гарри жарил яйца, когда Дадли, будучи сопровождаемым матерью [te], зашёл на кухню.",Harry was frying eggs by the time Dudley arrived in the kitchen with his mother.,нет,да,нет,нет,нет,нет,нет,нет,1,ТЭ,нет,образ действия,образ действия,prep,-,"[3 (te), (0)]",
2-10-34(1),大きなピンクの顔で、首はほとんどなく、薄い水色の小さな目をして、たっぷりとしたブロンドの髪が、たてにも横にも大きい顔の上に載っかっている。,"‘[У него было] большое розовое лицо [de], шеи почти не было [ku], узкие маленькие бледно-голубые глаза [te], светлые волосы обильно лежали там и сям на его большом лице.’","He had a large, pink face, not much neck, small, watery blue eyes and thick, blond hair that lay smoothly on his thick, fat head.",да,нет,да,нет,нет,нет,нет,нет,2,"ТЭ, И",нет,перечисление характеристик,перечисление характеристик,запятая,-,"[2 (te), (0)]","А в этом примере сначала идет КАО ДЭ (тэ-форма связки), затем НА-КУ  -это КУ-форма - аналог ТЭ-формы для прилагательных, а также для отрицания НАЙ и дезидератива ТАЙ. И только третьей - ТЭ-форма глагола. Так что тут тоже цепочка из трех конвербов. Интересно, что со стативами (в частности связками и прилагательными) получается, что отношения между звеньями цепочки - симметричные, это перечисление признаков."
2-10-34(2),大きなピンクの顔で、首はほとんどなく、薄い水色の小さな目をして、たっぷりとしたブロンドの髪が、たてにも横にも大きい顔の上に載っかっている。,"‘[У него было] большое розовое лицо [de], шеи почти не было [ku], узкие маленькие бледно-голубые глаза [te], светлые волосы обильно лежали там и сям на его большом лице.’","He had a large, pink face, not much neck, small, watery blue eyes and thick, blond hair that lay smoothly on his thick, fat head.",нет,нет,да,да,нет,нет,нет,нет,2,"И, ТЭ",нет,перечисление характеристик,перечисление характеристик,and,-,"[2 (te), (0)]",
2-10-36,ダドリーの方は、プレゼントの数を敢えていたが、突然顔色を変えてパパとママを見上げた,"Дадли же считал количество подарков, но резко изменил цвет лица [te] и поднял взгляд на папу с мамой.","Dudley, meanwhile, was counting his presents. His face fell. ‘Thirty-six,’ he said, looking up at his mother and father.",нет,да,нет,нет,нет,нет,нет,нет,1,ТЭ,нет,образ действия,-,-,-,"[2 (te), (0)]",
2-10-43,ハリーはダドリーのかんしゃく玉が大爆発寸前なのを感じて、いつテーブルがひっくり返されてもいいように大急ぎでベーコンに食らいついた。,"‘Когда Гарри почувствовал, что Дадли на грани взрыва от приступа ярости [te], и стол вот-вот перевернётся, в большой спешке вцепился зубами в бекон.’","Harry, who could see a huge Dudley tantrum coming on, began wolfing down his bacon as fast as possible in case Dudley turned the table over.",нет,нет,нет,да,нет,нет,нет,нет,1,ТЭ,нет,причинность,-,-,-,"[(3 te), (3)]","тут может быть симметрично, они оба зависимые"
2-11-3,やんちゃ君はパパと同じで、絶対損したくないってわけだ。なんてすごい子だ！ダドリーや,"“Непослушный мальчик, такой же, как и отец [te], ни за что не захочешь потерпеть неудачу. Удивительный ребёнок! Дадли”","‘Little tyke wants his money’s worth, just like his father. Atta boy, Dudley!",да,нет,нет,нет,нет,нет,нет,нет,1,ТЭ,да,перечисление характеристик,перечисление характеристик,запятая,-,"[2 (te), (0)]",
2-11-13,ハリーはいつも置いてけぼりで、ふた筋むこうに住んでいる変わりもののフィッグばあさんに預けられていた,"Гарри всегда оставляли [te], оставляли в двух кварталах с противоположной стороны у старухи Фигг.","Every year, Harry was left behind with Mrs Figg, a mad old lady who lived two streets away",да,нет,нет,нет,нет,нет,нет,нет,1,ТЭ,нет,образ действия,-,-,-,"[2 (te), (0)]",тут фактически топик!
2-11-20,ダーズリー夫妻はよくこんな風に、ハリーの目の前で、本人をまるで無視して話をした,"Супруги Дурсли часто так, полностью игнорируя Гарри прямо перед его глазами [te], разговаривали.","The Dursleys often spoke about Harry like this, as though he wasn’t there",нет,да,нет,нет,нет,нет,нет,нет,1,ТЭ,нет,образ действия,образ действия,like as,-,"[2 (te), (0)]",
2-11-33,ここ何年も本当に泣いたことなんてないが、顔をゆがめてメソメソすれば、母親がほしいものは何でもくれることを知っているのだ,"[Дадли] несколько лет по-настоящему не плакал, но [он] знает, что если скривить лицо [te] и сделать “плак-плак”, мать даст [ему] что угодно, что пожелает.","Dudley began to cry loudly. In fact, he wasn’t really crying, it had been years since he’d really cried, but he knew that if he screwed up his face and wailed, his mother would give him anything he wanted.",нет,да,нет,нет,нет,нет,нет,нет,1,ТЭ,нет,последовательность действий,последовательность действий,and,-,"[2 (te), (0)]",
2-11-40,抱きしめている母親の腕のすき閏から、ダドリーはハリーに向かって意地悪くニヤリと笑った,"Выглядывая из-за рук обнимающей его матери, Дадли повернулся к Дадли [te] и насмешливо ухмыльнулся.",He shot Harry a nasty grin through the gap in his mother’s arms.,нет,да,нет,нет,нет,нет,нет,нет,1,ТЭ,нет,образ действия,образ действия,prep,-,"[2 (te), (0)]",
2-11-43,――やがてダドリーの一の子分、ピアーズ・ポルキスが母親に連れられて部屋に入ってきた,"‘Наконец лучший друг Дадли, Пирс Полкисс, сопровождаемый матерью [te] зашёл в комнату.","and a moment later, Dudley’s best friend, Piers Polkiss, walked in with his mother.",нет,да,нет,нет,нет,нет,нет,нет,1,ТЭ,нет,образ действия,образ действия,prep,-,"[3 (te), (0)]",
2-12-10,ある時、床屋から帰ってきたハリーが、散髪する前と同じように髪が伸びているのを見て業をにやしたペチュニアおばさんが、キッチンバサミでクリクリに刈り上げたことがあった,"Однажды тётя Петунья, увидев, что Гарри вернулся из парикмахерской с такими же волосами, как и до этого [te], вышла из себя, кухонными ножницами остригла его налысо","Once, Aunt Petunia, tired of Harry coming back from the barber’s looking as though he hadn’t been at all, had taken a pair of kitchen scissors and cut his hair so short he was almost bald",нет,да,нет,нет,нет,нет,нет,нет,1,ТЭ,нет,причинность,причинность,ed,-,"[3 (te), (0)]",
2-12-13,ダドリーはハリーを見てバカ笑いしたし、ハリーは翌日の学校のことを思うと眠れなかった,"Дадли смотрел на Гарри [te], злобно усмехался, и Гарри не мог уснуть, думая о следующем дне в школе.","Dudley had laughed himself silly at Harry, who spent a sleepless night imagining school the next day, where he was already laughed at for his baggy clothes and Sellotaped glasses.",нет,да,нет,нет,нет,нет,нет,нет,1,ТЭ,нет,образ действия,образ действия,prep,-,"[2 (te), (0)]",
2-12-14,ただでさえ、ダブダブの服を着てセロテープだらけのメガネをかけたハリーは物笑いの種だった,"Но Гарри носил мешковатую одежду [te] и носил очки, все покрытые скотчем, был объектом насмешек",he was already laughed at for his baggy clothes and Sellotaped glasses.,нет,да,нет,нет,нет,нет,нет,нет,1,ТЭ,нет,перечисление характеристик,перечисление характеристик,and,-,"[(te), (2)]",
2-12-36(1),ムチャクチャな音を出して走りおって。チンピラどもが,"Издают сумасшедшие звуки [te], носятся [te]","roaring along like maniacs, the young hoodlums",нет,да,нет,нет,нет,нет,нет,нет,1,ТЭ,да,образ действия,образ действия,like,-,"[(te), (3)]","В этом и двух примерах ниже после ТЭ с точкой следует дискурсивный обрыв. Но в он оказывается разной природы. В 2-12-36 как бы прерывается ряд описаний плохого поведения героев ""носятся [и всякое такое, и вообще ] хулиганы"
2-12-36(2),ムチャクチャな音を出して走りおって。チンピラどもが,"Издают сумасшедшие звуки [te], носятся [te]","roaring along like maniacs, the young hoodlums",нет,нет,нет,нет,да,нет,нет,нет,1,ТЭ,да,дискурсивный обрыв,дискурсивный обрыв,точка,-,"[(te), (3)]",
2-12-47,その日はお天気もよく、土曜日で、動物園は家族連れで混み合っていた,"В этот день была хорошая погода [ku], была суббота [te], зоопарк был полон людей с семьями.",It was a very sunny Saturday and the zoo was crowded with families,да,нет,да,нет,нет,нет,нет,нет,2,"И, ТЭ",нет,фон-фигура,фон-фигура,and,-,"[2 (te), (0)]",
2-13-3,昼近くになると、ダドリーもピアーズも動物に飽きてきたので、かわりにお気に入りのハリー殴りを始めるかもしれないと思い、ハリーは慎重に二人から少し離れて歩くようにした,"Когда приблизился полдень, и Дадли, и Пирс устали от животных, поэтому Гарри аккуратно отделившись от них [te], попытался отойти, думая [i], что вместо этого они, возможно, начнут свои любимые избиения Гарри.","He was careful to walk a little way apart from the Dursleys so that Dudleyand Piers, who were starting to get bored with the animals by lunch-time, wouldn’t fall back on their favourite hobby of hitting him.",нет,да,нет,нет,нет,да,нет,нет,2,"И, ТЭ",нет,образ действия,образ действия,-,-,"[2 (te), (0)]",
2-13-7,館内はヒヤッとして暗く、壁に沿ってガラスケースが並び、中には照明がついていた,"Внутри было прохладно [te] и темно [ku], параллельно стенам стояли в ряд стеклянные витрины [i], внутри было освещение.","It was cool and dark in here, with lit windows all along the walls.",нет,да,да,нет,нет,да,нет,нет,3,"И, ТЭ, И",нет,перечисление характеристик,перечисление характеристик,and,-,"[2 (te), (0)]",
2-13-10(1),バーノンおじさんの車を二巻きにして砕いてくずかごに放り込みそうな大蛇だ,"Это была змея, которая могла бы, поделив машину дяди Вернона на две части [te], сломать её [te] и бросить в мусорку.",It could have wrapped its body twice around Uncle Vernon’s car and crushed it into a dust-bin,нет,да,нет,нет,нет,нет,нет,нет,1,ТЭ,нет,образ действия,образ действия,and,-,"[2 (te), (0)]",
2-13-10(2),バーノンおじさんの車を二巻きにして砕いてくずかごに放り込みそうな大蛇だ,"Это была змея, которая могла бы, поделив машину дяди Вернона на две части [te], сломать её [te] и бросить в мусорку.",It could have wrapped its body twice around Uncle Vernon’s car and crushed it into a dust-bin,нет,да,нет,нет,нет,нет,нет,нет,1,ТЭ,нет,последовательность действий,последовательность действий,-,-,"[2 (te), (0)]",
2-13-15,ダドリーは、ガラスに鼻を押しつけて、ツヤツヤと光る茶色のとぐろを見つめていた。,"‘Дадли прижался носом к стеклу [te], смотрел на сверкающие коричневые кольца.’","Dudley stood with his nose pressed against the glass, staring at the glistening brown coils.",нет,нет,нет,да,нет,нет,нет,нет,1,ТЭ,нет,образ действия,последовательность действий,ing,-,"[2 (te), (0)]","Дадли прижался, смотрел"
2-13-20,一日中、ガラスを叩いてチョッカイを出すバカな人間ども以外に友達もいない,"У [змеи] даже не было друзей, кроме глупых людей, целый день бьющих по стеклу [te] и мешающих [ей жить].",no company except stupid people drumming their fingers on the glass trying to disturb it all day long.,нет,да,нет,нет,нет,нет,нет,нет,1,ТЭ,нет,образ действия,образ действия,ing,-,"[2 (te), (0)]",
2-13-23,ハリーはガラスの前に来て、じっとヘビを見つめた。,"‘Гарри подошёл к окну [te], пристально уставился на змею.’",Harry moved in front of the tank and looked intently at the snake.,нет,нет,нет,да,нет,нет,нет,нет,1,ТЭ,нет,последовательность действий,последовательность действий,and,-,"[2 (te), (0)]","Гарри посмотрел, уставился"
2-13-25,あわてて誰か見ていないかと、周りを見まわした,"[Гарри] растерялся [te], осмотрелся по сторонам [пытаясь понять], смотрит ли кто-то.",Harry stared. Then he looked quickly around to see if anyone was watching. They weren’t,нет,да,нет,нет,нет,нет,нет,нет,1,ТЭ,нет,последовательность действий,последовательность действий,then,-,"[2 (te), (0)]",
2-13-50,へどがうなずいたとたん、ハリーの後ろで耳をつんざくような大声がして、ハリーもヘビも飛び上がりそうになった。,"‘Змея покачала головой, позади Гарри раздался громкий крик [te], и Гарри, и змея подпрыгнули.’","As the snake shook its head, a deafening shout behind Harry made both of them jump.",нет,нет,нет,да,нет,нет,нет,нет,1,ТЭ,нет,фон-фигура,-,as,-,"[(3 te), (2)]","а вот тут, кажется редкий случай, когда у ТЭ-формы свое подлежащее. Но и оно немного безличное: не Пирс завопил, а вопль раздался."
2-13-53,不意を食らってハリーはコンクリートの床にひっくり返った,"Застигнутый врасплох [te], Гарри упал на бетонный пол."," Caught by surprise, Harry fell hard on the concrete floor.",нет,да,нет,нет,нет,нет,нет,нет,1,ТЭ,нет,причинность,причинность,ed,-,"[(te), (2)]",
2-14-2,館内にいた客たちは叫び声を上げ、出口に向かってかけ出した,"Посетители в помещение издали вопль [i], повернувшись к выходу [te], начали выходить.","The great snake was uncoiling itself rapidly, slithering out on to the floor – people throughout the reptile house screamed and started running for the exits.",нет,да,нет,нет,нет,да,нет,нет,2,"И, ТЭ",нет,образ действия,образ действия,prep,-,"[2 (te), (0)]",
2-14-39,おばさんは、知っている人なのかと激しくハリーを問いつめ、何も買わずに二人を連れて店を飛び出した。,"Тётя разъярённо допросила Гарри, знает ли он этого человека [i], ничего не купив, вместе с ним [te] вылетела из магазина.","After asking Harry furiously if he knew the man, Aunt Petunia had rushed them out of the shop without buying anything.",нет,да,нет,нет,нет,да,нет,нет,2,"И, ТЭ",нет,образ действия,образ действия,ing,-,"[2 (te), (0)]",
2-14-40,一度はバスの中で、緑ずくめのとっぴな格好をしたおばあさんがハリーに向かってうれしそうに手を振った,"Один раз в автобусе тётя, дикая с виду и одетая полностью в зелёное, повернувшись к Гарри [te], радостно помахала рукой.",A wild-looking old woman dressed all in green had waved merrily at him once on a bus.,нет,да,нет,нет,нет,нет,нет,нет,1,ТЭ,нет,образ действия,образ действия,prep,-,"[3 (te), (0)]",
2-14-41,つい先日も、ひどく長い紫のマントを着たハゲ頭の男が、街中でハリーとしっかり握手までしてそのまま一言も言わずに立ち去った。,"Недавно лысый мужчина в ужасно длинной фиолетовой мантии в городе крепко пожал Гарри руку [te], не сказав ни слова, ушёл.",A bald man in a very long purple coat had actually shaken his hand in the street the other day and then walked away without a word.,нет,да,нет,нет,нет,нет,нет,нет,1,ТЭ,нет,последовательность действий,последовательность действий,and then,-,"[3 (te), (0)]",
3-14-49,やっとお許しが出て、物置から出してもらった時には、もう夏休みが始まっていた。,"‘Наконец-то [Гарри] дали разрешение [te], когда [он] вышел из чулана, уже начались летние каникулы. ’","By the time he was allowed out of his cupboard again, the summer holidays had started.",нет,нет,нет,да,нет,нет,нет,нет,1,ТЭ,нет,фон-фигура,фон-фигура,by the time,-,"[(3 te), (2)]",тут опять разносубъектность с безличным первым звеном: разрешение вышло (тэ) и гарри покинул чулан
