base_number,japanese_text,russian_translation,english_original,converb_te_copula,converb_te_no_comma,converb_i_adjective,converb_te_comma,converb_te_period,converb_i,converb_nagara,converb_tari,converbs_amount,types_of_converbs,direct_speech,connection_type_ja,connection_type_en,conjunction_original,lexis,subject,comments
3-14-51,ダドリーは、買ってもらったばかりの８ミリカメラをとっくに壊し、ラジコン飛行機も墜落させ、おまけに、レース用自転車に初めて乗ったその日に、プリベット通りを松葉杖で横切っていたフィッグばあさんにぶつかって、転倒させてしまうという事件も終わっていた。,"‘Дадли уже сломал едва купленную ему восьмимиллиметровую камеру [i], самолёт с дистанционным управлением тоже разбил [i], а более того, в тот же день, когда [он] впервые сел на [свой] гоночный велосипед, [он] врезался в переходившую Тисовую улицу на костылях тётушку Фигг [te], опрокинул её.’","Dudley had already broken his new cine-camera, crashed his remote-control aeroplane and, first time on his racing bike, knocked down old Mrs Figg as she crossed Privet Drive on her crutches.",нет,нет,нет,да,нет,2,нет,нет,3,"И, И, ТЭ ",нет,причинность,последовательность действий,-,"omakeni, mo","[3 (te), (0)]","Дадли сломал камеру, разбил самолёт и врезался в тётю (более того!! лекс маркер большего веса?)"
3-15-5(1),ピアーズ、デニス、マルコム、ゴードン、みんな揃いもそろってデカくてウスノロばかりだったが、なかでもとびきりデカで、ウスノロなのがダドリーだったので、軍団のリーダーはダドリーだった,"Пирс, Деннис, Малкольм и Гордон, все они поголовно были без исключения большими [kute] и глупыми, но среди них был самый большой [te] и глупый  – Дадли, поэтому он был предводителем армии.","Piers, Dennis, Malcolm and Gordon were all big and stupid, but as Dudley was the biggest and stupidest of the lot, he was the leader",нет,да,нет,нет,нет,нет,нет,нет,1,ТЭ,нет,перечисление характеристик,перечисление характеристик,and,-,"[3 (te), (0)]",тоже как будто бы топик
3-15-5(2),ピアーズ、デニス、マルコム、ゴードン、みんな揃いもそろってデカくてウスノロばかりだったが、なかでもとびきりデカで、ウスノロなのがダドリーだったので、軍団のリーダーはダドリーだった,"Пирс, Деннис, Малкольм и Гордон, все они поголовно были без исключения большими [kute] и глупыми, но среди них был самый большой [te] и глупый  – Дадли, поэтому он был предводителем армии.","Piers, Dennis, Malcolm and Gordon were all big and stupid, but as Dudley was the biggest and stupidest of the lot, he was the leader",да,нет,нет,нет,нет,нет,нет,нет,1,ТЭ,нет,перечисление характеристик,перечисление характеристик,and,-,"[3 (te), (0)]",
3-15-8, そういうわけで、ハリーは、なるべく家の外でぶらぶらして過ごすことにした。,"Поэтому Гарри, как можно больше шатаясь [te] за пределами дома, проводил время.","This was why Harry spent as much time as possible out of the house, wandering around.",нет,да,нет,нет,нет,нет,нет,нет,1,ТЭ,нет,образ действия,образ действия,ing,-,"[2 (te), (0)]",
3-15-14,二階に行って練習しようか,Хочешь пойти на второй этаж [te] и потренироваться?,Want to come upstairs and practise?,да,нет,нет,нет,нет,нет,нет,нет,1,ТЭ,да,последовательность действий,последовательность действий,and,-,"[2 (te), (0)]",
3-15-20,七月に入り、ペチュニアおばさんはダドリーを連れてロンドンまでスメルティングズ校の制服を買いに出かけた,"В июле тётя Петунья, взяв с собой Дадли [te], направилась в Лондон, чтобы купить форму для школы Смелтингс.",Aunt Petunia took Dudley to London to buy his Smeltings uniform.,нет,да,нет,нет,нет,нет,нет,нет,1,ТЭ,нет,образ действия,образ действия,to,-,"[2 (te), (0)]",
3-15-22,飼い猫の一匹につまずいて脚を骨折してからというもの、フィッグばあさんは前ほど猫好きではなくなったらしい,"Видимо, после того как она споткнулась об одну из своих кошек и сломала ногу, бабушка Фигг перестала любить кошек так сильно, как раньше.",It turned out she’d broken her leg tripping over one of her cats and she didn’t seem quite as fond of them as before.,нет,да,нет,нет,нет,нет,нет,нет,1,ТЭ,нет,образ действия,образ действия,ing,-,"[(te), (2)]",
3-15-25,その夜、ダドリーはピカピカの制服を着て居間を行進してみせた。,"Тем вечером Дадли, одетый в свою блестящую форму [te], промаршировал через гостиную.","That evening, Dudley paraded around the living-room for thefamily in his brand-new uniform.",нет,да,нет,нет,нет,нет,нет,нет,1,ТЭ,нет,образ действия,образ действия,prep,-,"[2 (te), (0)]",
3-15-27(1),てっぺんにこぶ状の握りのある杖を持つことになっていて、これはもっぱら先生が見ていないすきをねらって、生徒が互いに殴りあうために使われる。,"‘Было принято носить с собой палки с горбовидными рукоятями наверху [te], когда учитель не смотрит, ученики ловят момент [te] и пользуются ими, чтобы бить друг друга.’","They also carried knobbly sticks, used for hitting each other while the teachers weren’t looking.",нет,нет,нет,да,нет,нет,нет,нет,1,ТЭ,нет,образ действия,образ действия,ed,-,"[(3 te), (3)]","в англ. нет ""ловят момент"""
3-15-27(2),てっぺんにこぶ状の握りのある杖を持つことになっていて、これはもっぱら先生が見ていないすきをねらって、生徒が互いに殴りあうために使われる。,"‘Было принято носить с собой палки с горбовидными рукоятями наверху [te], когда учитель не смотрит, ученики ловят момент [te] и пользуются ими, чтобы бить друг друга.’","They also carried knobbly sticks, used for hitting each other while the teachers weren’t looking.",нет,нет,нет,да,нет,нет,нет,нет,1,ТЭ,нет,последовательность действий,последовательность действий,while,-,"[(3 te), (3)]",
3-15-29,真新しいニッカーボッカー姿のダドリーを見て、バーノンおじさんは、人生で最も誇らしい瞬間だと声をつまらせた。,"‘Увидев Дадли в новеньких бриджах [te], дядя Вернон сдавленным голосом сказал, что это самый гордый момент в его жизни.’","As he looked at Dudley in his new knickerbockers, Uncle Vernon said gruffly that it was the proudest moment of his life.",нет,нет,нет,да,нет,нет,нет,нет,1,ТЭ,нет,последовательность действий,последовательность действий,as,-,"[2 (te), (0)]",Вернон увидел Дадли и сказал
3-15-30,ペチュニアおばさんは、こんなに大きくなって、こんなにハンサムな子が、私のちっちゃなダドリー坊やだなんて、信じられないとうれし泣きした。,"‘Тётя Петунья плакала от счастья: “Не могу поверить, что мой маленький мальчик Дадли стал настолько большим [te], настолько красивым.’","Aunt Petunia burst into tears and said she couldn’t believe it was her Ickle Dudleykins, he looked so handsome and grown-up.",нет,нет,нет,да,нет,нет,нет,нет,1,ТЭ,да,перечисление характеристик,перечисление характеристик,and,повтор,"[3 (te), (0)]","перечисление характеристик, симметрия"
3-15-31,ハリーはとても何か言うどころではなく、笑いをこらえるのに必死で、あばら骨が二本折れたかと思うほど苦しかった,"У Гарри было слишком мало места, чтобы что-то сказать [ku], в отчаянии сдерживал смех [te], настолько переволновался, что думал, что сломал два ребра.",Harry didn’t trust himself to speak. He thought two of his ribs might already have cracked from trying not to laugh.,да,нет,да,нет,нет,нет,нет,нет,2,"И, ТЭ",нет,перечисление характеристик,-,-,-,"[2 (te), (0)]",
3-15-41,食卓について、ストーンウォール入学の第一日目の自分の姿を想像した……たぶん年とった象の皮を着たみたいに見えるだろうな……でもそれは考えないことにした。,"‘[Он] сел за стол [te], представил, как будет выглядеть в первый день своего поступления в “Хай Камеронс”... наверное, [он] выглядит так, будто надел кожу старого слона… Но решил не размышлять об этом.’","He sat down at the table and tried not to think about how he was going to look on his first day at Stonewall High – like he was wearing bits of old elephant skin, probably.",нет,нет,нет,да,нет,нет,нет,нет,1,ТЭ,нет,последовательность действий,последовательность действий,and,-,"[2 (te), (0)]",
3-15-44,ダドリーとバーノンおじさんが入ってきて、匂いに顔をしかめた。,"‘Дадли и дядя Вернон зашли [te], от запаха сморщили лица.’","Dudley and Uncle Vernon came in, both with wrinkled noses",нет,нет,нет,да,нет,нет,нет,нет,1,ТЭ,нет,последовательность действий,образ действия,with,-,"[3 (te), (0)]",
3-16-4,ハリーは手紙を拾い上げてまじまじと見つめた,Гарри взял письмо [te] и пристально посмотрел на него.,"Harry picked it up and stared at it, his heart twanging like a giant elastic band",нет,да,нет,нет,нет,нет,нет,нет,1,ТЭ,нет,последовательность действий,последовательность действий,and,-,"[2 (te), (0)]",
3-16-20,バーノンおじさんに請求書と絵葉書を渡し、椅子に座ってゆっくりと黄色の封筒を開きはじめた,"Он передал счет и открытку дяде Вернону [i], который сел в кресло [te] и медленно начал вскрывать желтый конверт.","He handed Uncle Vernon the bill and the postcard, sat down and slowly began to open the yellow envelope.",нет,да,нет,нет,нет,да,нет,нет,2,"И, ТЭ",нет,последовательность действий,последовательность действий,and,-,"[2 (te), (0)]",
3-16-31,とバーノンおじさんはせせら笑い、片手でパラっと手紙を開いてチラリと目をやった,"Дядя Вернон усмехнулся [i], одной рукой вскрыл письмо [te] и заглянул в него.","sneered Uncle Vernon, shaking the letter open with one hand and glancing at it",нет,да,нет,нет,нет,да,нет,нет,2,"И, ТЭ",нет,последовательность действий,последовательность действий,and,-,"[2 (te), (0)]",
3-16-36,ダドリーが手紙を奪って読もうとしたが、おじさんは手が届かないように高々と掲げていた,"Дадли взял письмо [te], чтобы попытаться прочитать его, но дядя держал его высоко, так, что не дотянуться.","Dudley tried to grab the letter to read it, but Uncle Vernon held it high out of his reach.",нет,да,нет,нет,нет,нет,нет,нет,1,ТЭ,нет,причинность,причинность,to,-,"[3 (te), (0)]",
3-17-30,おじさんは二、三回深呼吸して、無理に笑顔を取りつくろったが、相当苦しい笑顔だった。,"‘Дядя два-три раза тяжело вздохнул [te], выдавил улыбку, но [эта] улыбка была достаточно болезненная.’","He took a few deep breaths and then forced his face into a smile, which looked quite painful.",нет,нет,нет,да,нет,нет,нет,нет,1,ТЭ,нет,последовательность действий,последовательность действий,and,-,"[2 (te), (0)]",
3-17-34,ベッドに腰かけて周りを見回すと、ガラクタばかりが置いてあった,"Он сел на кровать [te], огляделся вокруг и увидел только хлам.",He sat down on the bed and stared round him.,нет,да,нет,нет,нет,нет,нет,нет,1,ТЭ,нет,последовательность действий,последовательность действий,and,-,"[2 (te), (0)]",
3-17-36,ダドリーがその戦車に乗って隣の犬を轢いてしまったことがある。,"Случилось и такое, что Дадли верхом на этом танке [te] переехал соседскую собаку.","The month-old cine-camera was lying on top of a small, working tank Dudleyhad once driven over next door’s dog;",нет,да,нет,нет,нет,нет,нет,нет,1,ТЭ,нет,образ действия,образ действия,prep,-,"[3 (te), (0)]",
3-17-37(1),隅に置かれたダドリーの一台目のテレビは、お気に入りの番組が中止になったと言って蹴りつけて大穴をあけてしまった,"Первый свой стоявший в углу телевизор Дадли, сказав [te], что его любимую программу отменили, пнул [te] и тем самым проделал в нём большую дыру."," in the corner was Dudley’s first-ever television set, which he’d put his foot through when his favourite programme had been cancelled",нет,да,нет,нет,нет,нет,нет,нет,1,ТЭ,нет,причинность,причинность,when,-,"[3 (te), (0)]",
3-17-37(2),隅に置かれたダドリーの一台目のテレビは、お気に入りの番組が中止になったと言って蹴りつけて大穴をあけてしまった,"Первый свой стоявший в углу телевизор Дадли, сказав [te], что его любимую программу отменили, пнул [te] и тем самым проделал в нём большую дыру."," in the corner was Dudley’s first-ever television set, which he’d put his foot through when his favourite programme had been cancelled",нет,да,нет,нет,нет,нет,нет,нет,1,ТЭ,нет,образ действия,образ действия,prep,-,"[3 (te), (0)]",
3-17-39,その銃は、ダドリーが尻に敷いて銃身をひどく曲げてしまい、今は棚の上にほったらかしになっている,"Ружьё, на которое Дадли так сильно уселся задом [te], что погнул его [i], сейчас лежало на полке в одиночестве.","a real air-rifle, which was up on a shelf with the end all bent because Dudley had sat on it",нет,да,нет,нет,нет,да,нет,нет,2,"ТЭ, И",нет,причинность,причинность,because,-,"[2 (te), (0)]",
3-17-41,下からダドリーが母親に向かって喚いているのが聞こえた,"Он услышал, как Дадли, повернувшись лицом к матери [te], кричит на неё. ",From downstairs came the sound of Dudley bawling at his mother:,нет,да,нет,нет,нет,нет,нет,нет,1,ТЭ,нет,образ действия,образ действия,prep,-,"[2 (te), (0)]",
3-18-3,喚いたり、父親をスメルティングズ杖で叩いたり、わざと気分が悪くなってみせたり、母親を蹴飛ばしたり、温室の屋根をぶち破って亀を放り投げたり、それでも部屋は取り戻せなかったからだ,"Потому что он и кричал [tari], и бил [tari] отца тростью Смелтингса, и нарочно старался [tari] сделать ему больно, и пинал [tari] мать, проломил [te] крышу теплицы и бросил [tari] черепаху, и всё равно не получил свою комнату обратно.","He’d screamed, whacked his father with his Smeltings stick, been sick on purpose, kicked his mother and thrown his tortoise through the greenhouse roof and he still didn’t have his room back",нет,да,нет,нет,нет,нет,нет,5,6,"ТАРИ, ТАРИ, ТАРИ, ТАРИ, ТЭ, ТАРИ",нет,образ действия,образ действия,prep,-,"[3 (te), (0)]",
3-18-10,バーノンおじさんは首を締められたような叫び声を上げて椅子から跳び上がり、廊下をかけ出した,"Дядя Вернон, издав [te] вопль, похожий на крик задушенного, вскочил с кресла [i] и выбежал в коридор.","With a strangled cry, Uncle Vernon leapt from his seat and ran down the hall, Harry right behind him.",нет,да,нет,нет,нет,да,нет,нет,2,"ТЭ, И",нет,образ действия,образ действия,prep,-,"[3 (te), (0)]",
3-18-26,ハリーは空中に跳び上がった――玄関マットの上で、何か大きくてグニャッとしたものを踏んだ…,Гарри подпрыгнул в воздух - он наступил на что-то большое [te] и хлюпающее на входном коврике...,Harry leapt into the air – he’d trodden on something big and squashy on the doormat – something alive!,нет,да,нет,нет,нет,нет,нет,нет,1,ТЭ,нет,перечисление характеристик,перечисление характеристик,and,-,"[3 (te), (0)]",
3-18-28,大きくてダニャッとしたものは、なんと、バーノンおじさんの顔だった。,"К его удивлению, большая [te] болтающаяся штука оказалась лицом дяди Вернона.",Lights clicked on upstairs and to his horror Harry realised that the big squashy something had been his uncle’s face.,нет,да,нет,нет,нет,нет,нет,нет,1,ТЭ,нет,перечисление характеристик,перечисление характеристик,-,-,"[(0 te), (3)]",
3-18-30,おじさんは、まさにハリーのやろうとしたことを阻止するために、寝袋にくるまって玄関のドアの前で横になっていたのだ,"Дядя лежал перед входной дверью, завернувшись [te] в спальный мешок, чтобы помешать Гарри сделать именно то, что он собирался сделать.","Uncle Vernon had been lying at the foot of the front door in a sleepingbag, clearly making sure that Harry didn’t do exactly what he’d been trying to do.",нет,да,нет,нет,нет,нет,нет,нет,1,ТЭ,нет,образ действия,образ действия,prep,-,"[3 (te), (0)]",
3-18-25,取っ組み合いの大混戦がしぼらく続き、みんないやというほどスメルティングズ杖を食らって、やがて息も絶えだえに立ち上がったのはバーノンおじさんだった。,"‘Некоторое время продолжалась схватка [i], все до невозможного получили узловатой палкой [te], в конце концов со слабым дыханием встал дядя Вернон. Он крепко держал [в руке] письмо для Гарри.’","After a minute of confused fighting, in which everyone got hit a lot by the Smeltings stick, Uncle Vernon straightened up, gasping for breath, with Harry’s letter clutched in his hand.",нет,нет,нет,да,нет,да,нет,нет,2,"И, ТЭ",нет,фон-фигура,фон-фигура,after,yagate,"[(3 te), (2)]",
3-18-56,手紙を全部焼き捨て、釘と金槌を取り出すと、玄関と裏口のドアのすき間というすき間に板を打ちつけ、誰一人外に出られないようにした。,"‘Он сжёг все письма [te], а когда достал гвозди и молоток, то прибил доску в щель входной и задней дверей [i], сделал так, чтобы никто не мог выйти наружу.’","After burning all the letters, he got out a hammer and nails and boarded up the cracks around the front and back doors so no one could go out.",нет,нет,нет,да,нет,да,нет,нет,2,"ТЭ, И",нет,последовательность действий,последовательность действий,after,-,"[2 (te), (0)]",
3-19-2,ダドリーも驚いてハリーに聞いた。,Дадли тоже удивился [te] и спросил Гарри.,‘Who on earth wants to talk to you this badly?’ Dudley asked Harry in amazement.,нет,да,нет,нет,нет,нет,нет,нет,1,ТЭ,нет,образ действия,образ действия,prep,-,"[3 (te), (0)]",
3-19-7(1),そう言い終わらないうちに、何かがキッチンの煙突を伝ってヒューッと落ちてきて、おじさんの後頭部にこつんとぶつかった。,"‘Не успел [он] договорить, как что-то, следуя по дымоходу на кухне [te], со свистом вылетело [te], со стуком ударило по затылку дяди.’",Something came whizzing down the kitchen chimney as he spoke and caught him sharply on the back of the head.,нет,да,нет,нет,нет,нет,нет,нет,1,ТЭ,нет,последовательность действий,последовательность действий,and,-,"[3 (te), (0)]",
3-19-7(2),そう言い終わらないうちに、何かがキッチンの煙突を伝ってヒューッと落ちてきて、おじさんの後頭部にこつんとぶつかった。,"‘Не успел [он] договорить, как что-то, следуя по дымоходу на кухне [te], со свистом вылетело [te], со стуком ударило по затылку дяди.’",Something came whizzing down the kitchen chimney as he spoke and caught him sharply on the back of the head.,нет,нет,нет,да,нет,нет,нет,нет,1,ТЭ,нет,образ действия,образ действия,ing,-,"[3 (te), (0)]",
3-19-9,ダーズリーたちはみんな身をかわしたが、ハリーは飛びついて手紙を捕まえようとした,"Все Дурсли уклонились, но Гарри успел подпрыгнуть [te] и поймать письмо.","The Dursleys ducked, but Harry leapt into the air trying to catch one –",нет,да,нет,нет,нет,нет,нет,нет,1,ТЭ,нет,образ действия,образ действия,ing,-,"[3 (te), (0)]",
3-19-11,バーノンおじさんはハリーの腰のあたりを捕まえて、廊下に放り出した。,"‘Дядя Вернон схватил Гарри за пояс [te], вышвырнул в коридор.’",Uncle Vernon seized Harry around the waist and threw him into the hall.,нет,нет,нет,да,нет,нет,нет,нет,1,ТЭ,нет,последовательность действий,последовательность действий,and,-,"[2 (te), (0)]",
