base_number,japanese_text,russian_translation,english_original,converb_te_copula,converb_te_no_comma,converb_i_adjective,converb_te_comma,converb_te_period,converb_i,converb_nagara,converb_tari,converbs_amount,types_of_converbs,direct_speech,connection_type_ja,connection_type_en,conjunction_original,lexis,subject,comments
1-2-3,不思議とか神秘とかそんな非常識はまるっきり認めない人種で、まか不思議な出来事が彼らの周辺で起こるなんて、とうてい考えられなかった,"[Они] были такими людьми, которые абсолютно не позволили бы [произойти] такому абсурду, как странности или загадки [te], и никоим образом не смогли бы представить, что в их окружении возникнет что-то вроде большой странности.","They were the last people you’d expect to be involved in anything strange or mysterious, because they just didn’t hold with such nonsense.",да,нет,нет,нет,нет,нет,нет,нет,1,ТЭ,нет,причинность,причинность,because,-,"[2 (te), (0)]",
1-2-7(1),奥さんの方はやせて、金髪で、なんと首の長さが普通の人の二倍はある。,"‘Что же касается жены, то она была худой [te], блондинкой [te], и с шеей в два раза длиннее [шеи] обычного человека.’","Mrs Dursley was thin and blonde and had nearly twice the usual amount of neck, which came in very useful as she spent so much of her time craning over garden fences, spying on the neighbours.",нет,нет,нет,да,нет,нет,нет,нет,1,ТЭ,нет,перечисление характеристик,перечисление характеристик,and ,-,"[2 (te), (0)]","ВА (ТЭ, ...)"
1-2-7(2),奥さんの方はやせて、金髪で、なんと首の長さが普通の人の二倍はある。,"‘Что же касается жены, то она была худой [te], блондинкой [te], и с шеей в два раза длиннее [шеи] обычного человека.’","Mrs Dursley was thin and blonde and had nearly twice the usual amount of neck, which came in very useful as she spent so much of her time craning over garden fences, spying on the neighbours.",да,нет,нет,нет,нет,нет,нет,нет,1,ТЭ,нет,перечисление характеристик,перечисление характеристик,and ,-,"[2 (te), (0)]",
1-2-31,八時半、ダーズリー氏は鞄を持ち、奥さんの頬にちょこっとキスして、それからダドリー坊やにもバイバイのキスをしようとしたが、しそこなった。,"‘В половине девятого мистер Дурсль, держа сумку [i], коротко поцеловал жену в щёку [te], а затем попытался поцеловать на прощание и сына Дадли тоже, но промахнулся, потому что сын, разозлившись, бросил в центр стены тарелку хлопьев.’","At half past eight, Mr. Dursley picked up his briefcase, pecked Mrs. Dursley on the cheek, and tried to kiss Dudley good-bye but missed, because Dudley was now having a tantrum and throwing his cereal at the walls.",нет,нет,нет,да,нет,да,нет,нет,2,"И, ТЭ",нет,последовательность действий,последовательность действий,and ,-,"[2 (te), (0)]",
1-2-32,坊やがかんしゃくを起こして、コーンフレークを皿ごと壁に投げつけている最中だったからだ。,"‘...потому что сын, разозлившись [te], бросил в центр стены тарелку хлопьев.’",because Dudley was now having a tantrum and throwing his cereal at the walls.,нет,нет,нет,да,нет,нет,нет,нет,1,ТЭ ,нет,причинность,последовательность действий,and ,-,"[3 (te), (0)]","ГА (ТЭ, ...)"
1-2-34,「わんぱく坊主め」ダーズリー氏は満足げに笑いながら家を出て、自家用車に乗りこみ、四番地の路地をバックで出て行った。,"“Непослушный мальчик,” – с довольным видом рассмеявшись [nagara], мистер Дурсль вышел из дома [te], сел в автомобиль [i] и выехал из переулка номер четыре.’","‘Little tyke,’ chortled Mr Dursley as he left the house. He got into his car and backed out of number four’s drive.",нет,нет,нет,да,нет,да,да,нет,3,"НАГАРА, ТЭ, И",нет,последовательность действий,последовательность действий,and,-,"[2 (te), (0)]","Интересно, этот прогрессив включает в сферу действия предыдущее ДЭТЭ. У меня пока нет ответа, а это важно"
1-2-39,ダーズリー氏は瞬きをして、もう一度猫をよく見なおした。,"‘Мистер Дурсль ещё раз моргнул [te], внимательно посмотрел на кошку.’",Mr Dursley blinked and stared at the cat.,нет,нет,нет,да,нет,нет,нет,нет,1,ТЭ,нет,последовательность действий,последовательность действий,and,-,"[2 (te), (0)]",
1-2-41,ダーズリー氏は体をブルッと振って気をとりなおし、猫のことを頭の中から振り払った,"Мистер Дурсль потряс телом [te], пришёл в себя [i], выбросил кошку из головы.",Mr Dursley gave himself a little shake and put the cat out of his mind.,нет,да,нет,нет,нет,да,нет,нет,2,"ТЭ, И",нет,последовательность действий,последовательность действий,and,-,"[2 (te), (0)]",
1-2-42,街に向かって車を走らせているうちに、彼の頭は、その日に取りたいと思っている穴あけドリルの大口注文のことでいっぱいになった,"Пока [он], повернувшись к городу [te], вёл машину, его голова была полна [мыслей о том], как он хочет сегодня взять большой заказ на дрели.",As he drove towards town he thought of nothing except a large order of drills he was hoping to get that day.,нет,да,нет,нет,нет,нет,нет,нет,1,ТЭ,нет,образ действия,образ действия,prep,-,"[2 (te), (0)]",
1-3-2,何やら興奮してささやき合っている,"[Они], волнуясь [te], о чём-то шептались друг с другом.",They were whispering excitedly together,нет,да,нет,нет,нет,нет,нет,нет,1,ТЭ,нет,образ действия,образ действия,adv,-,"[2 (te), (0)]",
1-3-9(1),ダーズリー氏のオフィスは九階で、いつも窓に背を向けて座っていた,"Офис мистера Дурсля [был] на девятом этаже [te], [где он] всегда сидел, повернувшись к окну спиной [te].",Mr Dursley always sat with his back to the window in his office on the ninth floor.,да,нет,нет,нет,нет,нет,нет,нет,1,ТЭ,нет,фон-фигура,фон-фигура,prep,-,"[(2 te), (2)]","(2 ТЭ), (2 ...) разные подлежащие, офис и Дурсль"
1-3-9(2),ダーズリー氏のオフィスは九階で、いつも窓に背を向けて座っていた,"Офис мистера Дурсля [был] на девятом этаже [te], [где он] всегда сидел, повернувшись к окну спиной [te].",Mr Dursley always sat with his back to the window in his office on the ninth floor.,нет,да,нет,нет,нет,нет,нет,нет,1,ТЭ,нет,образ действия,образ действия,prep,-,"[2 (te), (0)]",
1-3-10,ふくろうが次から次へと飛んで行くのを指さしては、いったいあれは何だと口をあんぐりあけて見つめていたのだ," [Они] указывали пальцем на то, как совы летят одна за другой, “Что это вообще такое?” – широко открыв рты [te], [они] наблюдали [за совами].",they pointed and gazed open-mouthed as owl after owl sped overhead.,нет,да,нет,нет,нет,нет,нет,нет,1,ТЭ,нет,образ действия,образ действия,ed,-,"[2 (te), (0)]",
1-3-12,それから、少し手足を伸ばそうかと、道路のむかい側にあるパン屋まで歩いて買い物に行くことにした,"Затем, желая размять конечности, решил пройтись пешком до булочкой с противоположной стороны дороги [te], сходить за покупками.","He was in a very good mood until lunch-time, when he thought he’d stretch his legs and walk across the road to buy himself a bun from the baker’s opposite.",нет,да,нет,нет,нет,нет,нет,нет,1,ТЭ,нет,образ действия,-,to,-,"[2 (te), (0)]",
1-3-26,いったんはヒソヒソ声のするほうを振り返って、何か言おうかと思ったが、まてよ、と考えなおした。,"‘Мистер Дурсль резко замер. Его быстро заполонил страх. Он быстро повернулся в сторону шепчущих голосов [te], желая что-то сказать, но передумал.’","Mr. Dursley stopped dead. Fear flooded him. He looked back at the whisperers as if he wanted to say something to them, but thought better of it.",нет,нет,нет,да,нет,нет,нет,нет,1,ТЭ,нет,образ действия,последовательность действий,as ,-,"[2 (te), (0)]",
1-3-27,ダーズリー氏は猛スピードで道を横切り、オフィスにかけ戻るや否や、秘書に「誰も取り継ぐな」と命令し、ドアをピシャッと閉めて電話をひっつかみ、家の番号を回しはじめた,"Мистер Дурсль на большой скорости пересёк дорогу [i], как только вернулся в офис, приказал секретарше, чтобы его никто не беспокоил [i], захлопнул дверь [te], схватил телефон [i], начал набирать номер дома.","He dashed back across the road, hurried up to his office, snapped at his secretary not to disturb him, seized his telephone and had almost finished dialling his home number when he changed his mind.",нет,да,нет,нет,нет,3,нет,нет,4,"И, И, ТЭ, И",нет,последовательность действий,последовательность действий,and,-,"[2 (te), (0)]",
1-3-40(1),相手は小さな老人で、よろけて転びそうになった,"“Извините,” – издал стон мистер Дурсль. Собеседником был маленький старик [te], [который], споткнувшись [te], почти упал.","‘Sorry,’ he grunted, as the tiny old man stumbled and almost fell",да,нет,нет,нет,нет,нет,нет,нет,1,ТЭ,нет,фон-фигура,фон-фигура,as ,-,"[2 (te), (0)]",
1-3-40(2),相手は小さな老人で、よろけて転びそうになった,"“Извините,” – издал стон мистер Дурсль. Собеседником был маленький старик [te], [который], споткнувшись [te], почти упал.","‘Sorry,’ he grunted, as the tiny old man stumbled and almost fell",нет,да,нет,нет,нет,нет,нет,нет,1,ТЭ,нет,последовательность действий,последовательность действий,and,,"[2 (te), (0)]",
1-3-42,それどころか、顔が上下に割れるかと思ったほど大きくにっこりして、道行く人が振り返るほどのキーキー声でこう言った。,"‘Хоть [его] и почти сбили с ног на землю, эта ситуация совершенно [его] не расстроила. Напротив, настолько, будто его лицо расколется пополам, широко улыбнувшись [te], он сказал настолько визгливым голосом, что идущие по улице люди обернулись: … ’","He didn’t seem at all upset at being almost knocked to the ground. On the contrary, his face split into a wide smile and he said in a squeaky voice that made passers-by stare…",нет,нет,нет,да,нет,нет,нет,нет,1,ТЭ,нет,последовательность действий,фон-фигура,-,-,"[2 (te), (0)]",
1-3-47,急いで車に乗り込むと、ダーズリー氏は家に向かって走り出した,"Когда [он] быстро сел в машину, мистер Дурсль, повернувшись к дому [te], поехал.",He hurried to his car and set off home,нет,да,нет,нет,нет,нет,нет,нет,1,ТЭ,нет,образ действия,образ действия,дополнение,-,"[(te), (2)]",
1-4-29,奥さんが紅茶を二つ持って居間に入ってきた,"Жена, держа две [чашки] чая [te], вошла в гостиную.",Mrs Dursley came into the living-room carrying two cups of tea.,нет,да,нет,нет,нет,нет,нет,нет,1,ТЭ,нет,образ действия,образ действия,ing,-,"[3 (te), (0)]",
1-4-39, 奥さんは口をすぼめて紅茶をすすった,"Жена, поджав губы [te], отпила чай.",Mrs Dursley sipped her tea through pursed lips,нет,да,нет,нет,нет,нет,нет,нет,1,ТЭ,нет,образ действия,образ действия,ed,-,"[2 (te), (0)]",
1-5-8(1),そう思うと少しホッとして、ダーズリー氏はあくびをして寝返りを打った。,"Супруги Поттеры наверняка знают, что мы думаем о них двоих и [той] компании. “Не знаю, что происходит, но мы с Петуньей не будем вмешиваться,” – подумав так, мистер Дурсль слегка выдохнул с облегчением [te] зевнул, сделав “по” [te], и перевернулся [на другой бок].","His last, comforting thought before he fell asleep was that even if Potters were involved, there was no reason for them to come near him and Mrs. Dursley. The Potters knew very well what he and Petunia could get mixed up in anything that might be going on – he yawned and turned over – it couldn`t affect them…",нет,нет,нет,да,нет,нет,нет,нет,1,ТЭ,нет,образ действия,образ действия,-,-,"[(te), (2)]","(ТЭ, .... ВА )"
1-5-8(2),そう思うと少しホッとして、ダーズリー氏はあくびをして寝返りを打った。,"Супруги Поттеры наверняка знают, что мы думаем о них двоих и [той] компании. “Не знаю, что происходит, но мы с Петуньей не будем вмешиваться,” – подумав так, мистер Дурсль слегка выдохнул с облегчением [te] зевнул, сделав “по” [te], и перевернулся [на другой бок].","His last, comforting thought before he fell asleep was that even if Potters were involved, there was no reason for them to come near him and Mrs. Dursley. The Potters knew very well what he and Petunia could get mixed up in anything that might be going on – he yawned and turned over – it couldn`t affect them…",нет,да,нет,нет,нет,нет,нет,нет,1,ТЭ,нет,последовательность действий,последовательность действий,and,,,
1-5-14,真夜中近くになって、初めて猫は動いた。,"‘Наступило около полуночи [te], кошка впервые зашевелилась.’","In fact, it was nearly midnight before the cat moved at all.",нет,нет,нет,да,нет,нет,нет,нет,1,ТЭ,нет,фон-фигура,фон-фигура,before,-,"[(0 te), (2)]","Кажется, это первый случай разносубъектного употребления ТЭ. Да и то, клауза с ТЭ полноценного субъекта не имеет"
1-5-16,猫はしっぽをピクッとさせて、目を細めた。,"‘Кошка дёрнула хвостом [te], сузила глаза.’",The cat’s tail twitched and its eyes narrowed.,нет,нет,нет,да,нет,нет,нет,нет,1,ТЭ,нет,последовательность действий,фон-фигура,and,-,"[2 (te), (0)]","на самом деле ""сузила глаза"". Т.е. в англ и РОП - разносубъектные конструкции, а здесь - один (кошка) и этот субъект топикализован"
1-5-28,ふたをパチンと開け、高くかざして、カチッと鳴らした。,"‘[Он] с щелчком открыл крышку [i], высоко поднял [зажигалку] [te], щёлкнул.’","He flicked it open, held it up in the air and clicked it.",нет,нет,нет,да,нет,да,нет,нет,2,"И, ТЭ",нет,последовательность действий,последовательность действий,and,-,"[2 (te), (0)]","О, интересно! здесь сначала другой конверб (2-я основа), а потом ТЭ. В литературе пишут, что ТЭ связывает сильнее. Т.е. Он открыл. А потом - поднял зажигалку и щелкнул."
1-5-32,もう一度カチッといわせた。次の街灯がゆらめいて闇の中に消えていった,"Ещё один раз издал “щёлк”. Следующий фонарь замерцал [te], исчез во тьме.",He clicked it again – the next lamp flickered into darkness.,нет,да,нет,нет,нет,нет,нет,нет,1,ТЭ,нет,последовательность действий,-,prep,-,"[3 (te), (0)]",
1-5-34,一息おくと、顔は向けずに、猫に向かって話しかけた,"Когда перевёл дыхание, не поворачивая головы, повернувшись к кошке [te], заговорил."," He didn’t look at it, but after a moment he spoke to it.",нет,да,нет,нет,нет,нет,нет,нет,1,ТЭ,нет,образ действия,образ действия,to,-,"[2 (te), (0)]",
1-5-37,かわりに、厳格そうな女の人が、あの猫の目の周りにあった縞模様とそっくりの四角いメガネをかけて座っていた,"Вместо этого строго выглядящая женщина, надев похожие на кошачьи полоски вокруг глаз квадратные очки [te], сидела.",Instead he was smiling at a rather severe-looking woman who was wearing squareglasses exactly the shape of the markings the cat had had around its eyes.,нет,да,нет,нет,нет,нет,нет,нет,1,ТЭ,нет,образ действия,-,-,-,"[3 (te), (0)]",
1-5-40,黒い髪をひっつめて、小さな髷にしている。,"‘[Она] стянула чёрные волосы [te], сделала маленький пучок.’",Her black hair was drawn into a tight bun.,нет,нет,нет,да,нет,нет,нет,нет,1,ТЭ,нет,образ действия,-,-,-,"[2 (te), (0)]",
1-5-41,女の人は見破られて動揺していた,"Женщина, будучи обнаруженной [te], смутилась.",She looked distinctly ruffled.,нет,да,нет,нет,нет,нет,нет,нет,1,ТЭ,нет,причинность,образ действия,-,-,"[2 (te), (0)]",
1-7-19,ダンブルドアは大きく鼻をすすると、ポケットから金時計を取り出して時間を見た,"Дамблдор шумно вздохнул, достал из кармана золотые часы [te], посмотрел на время.",Dumbledore gave a great sniff as he took a golden watch from his pocket and examined it,нет,да,нет,нет,нет,нет,нет,нет,1,ТЭ,нет,последовательность действий,последовательность действий, and,-,"[2 (te), (0)]",
1-7-42,あの子に受け入れる準備ができるまで、そうしたことから一切離れて育つ方がずっといいということがわからんかね？,"Тому ребёнку расти, отделённым от всего этого до того, как он сможет это принять [te], будет намного лучше – вы ведь это понимаете?"," Can’t you see how much better off he’ll be, growing up away from all that until he’s ready to take it?",нет,да,нет,нет,нет,нет,нет,нет,1,ТЭ,да,образ действия,образ действия,prep,-,"[2 (te), (0)]",
1-7-48,マクゴナガル先生は口を開きかけたが、思いなおして、喉まで出かかった言葉をのみ込んだ。,"‘Профессор МакГонагалл распахнула рот, но передумала [te], проглотила слова, вертевшиеся [у неё] на языке.’","Professor McGonagall opened her mouth, changed her mind, swallowed and then said: …",нет,нет,нет,да,нет,нет,нет,нет,1,ТЭ,нет,последовательность действий,последовательность действий,запятая ,-,"[2 (te), (0)]",
1-8-10,――大きなオートバイが空からドーンと降ってきて、二人の目の前に着陸した。,"‘Большой мотоцикл с рёвом упал с неба [te], приземлился перед их глазами.’",a huge motorbike fell out of the air and landed on the road in front of them.,нет,нет,нет,да,нет,нет,нет,нет,1,ТЭ,нет,последовательность действий,последовательность действий,and,-,"[3 (te), (0)]",
1-8-13,許しがたいほど大きすぎて、それになんて荒々しい――ボウボウとした黒い髪とひげが、長くモジャモジャと絡まり、ほとんど顔中を覆っている。,"‘[Он] был слишком большой [te], кроме того, какой-то яростный – [вид у него] был дикий, узлы яростных чёрных волос и лохматой бороды почти [полностью] закрывали [его] лицо.’","He looked simply too big to be allowed, and so wild – long tangles of bushy black hair and beard hid most of his face",нет,нет,нет,да,нет,нет,нет,нет,1,ТЭ,нет,перечисление характеристик,перечисление характеристик,", and",soreni,"[2 (te), (0)]","Этого подлежащего вовсе не видно (опущено), оно топикализовано и есть где-то слева"
1-8-47,ダンブルドアは庭の低い生垣をまたいで、玄関へと歩いていった。,"‘Дамблдор перешагнул через низкий забор сада [te], подошёл к входной двери.’",Dumbledore stepped over the low garden wall and walked to the front door.,нет,нет,нет,да,нет,нет,нет,нет,1,ТЭ,нет,последовательность действий,последовательность действий,and,-,"[2 (te), (0)]",
1-8-49,三人は、まるまる一分間そこにたたずんで、小さな毛布の包みを見つめていた。,"‘Трое целую минуту стояли [te], смотрели на маленький свёрток из одеяла.’",For a full minute the three of them stood and looked at the little bundle;,нет,нет,нет,да,нет,нет,нет,нет,1,ТЭ,нет,образ действия,последовательность действий,and,-,"[2 (te), (0)]",
1-9-6,バイクはうなりを上げて空に舞い上がり、夜の闇へと消えていった,"Мотоцикл издал рёв [te], взмыл в небо [i], исчез в вечерней тьме.",with a roar it rose into the air and off into the night.,нет,да,нет,нет,нет,да,нет,нет,2,"ТЭ, И",нет,последовательность действий,последовательность действий,and,-,"[2 (te), (0)]",
